"No.","Time","Source","Destination","Protocol","Length","Info","Window"
"28","4.590540","192.168.1.122","130.192.1.34","TCP","66","64176  >  80 [SYN] Seq=0 Win=64240 Len=0 MSS=1460 WS=256 SACK_PERM=1","64240"
"29","4.608076","130.192.1.34","192.168.1.122","TCP","66","80  >  64176 [SYN, ACK] Seq=0 Ack=1 Win=29200 Len=0 MSS=1460 SACK_PERM=1 WS=128","29200"
"30","4.608344","192.168.1.122","130.192.1.34","TCP","54","64176  >  80 [ACK] Seq=1 Ack=1 Win=131328 Len=0","513"
"31","4.614713","192.168.1.122","130.192.1.34","HTTP","224","GET /~lioy/01nbe/lab2/test1m.dat HTTP/1.1 ","513"
"32","4.638813","130.192.1.34","192.168.1.122","TCP","60","80  >  64176 [ACK] Seq=1 Ack=171 Win=30336 Len=0","237"
"33","4.638813","130.192.1.34","192.168.1.122","HTTP","454","HTTP/1.1 301 Moved Permanently  (text/html)","237"
"34","4.689472","192.168.1.122","130.192.1.34","TCP","66","64177  >  443 [SYN] Seq=0 Win=64240 Len=0 MSS=1460 WS=256 SACK_PERM=1","64240"
"35","4.693178","192.168.1.122","130.192.1.34","TCP","54","64176  >  80 [ACK] Seq=171 Ack=401 Win=130816 Len=0","511"
"36","4.708702","130.192.1.34","192.168.1.122","TCP","66","443  >  64177 [SYN, ACK] Seq=0 Ack=1 Win=29200 Len=0 MSS=1460 SACK_PERM=1 WS=128","29200"
"37","4.708978","192.168.1.122","130.192.1.34","TCP","54","64177  >  443 [ACK] Seq=1 Ack=1 Win=131328 Len=0","513"
"38","4.715543","192.168.1.122","130.192.1.34","TLSv1.2","462","Client Hello","513"
"39","4.732904","130.192.1.34","192.168.1.122","TCP","60","443  >  64177 [ACK] Seq=1 Ack=409 Win=30336 Len=0","237"
"40","4.734850","130.192.1.34","192.168.1.122","TLSv1.2","1514","Server Hello","237"
"41","4.734850","130.192.1.34","192.168.1.122","TCP","1514","443  >  64177 [ACK] Seq=1461 Ack=409 Win=30336 Len=1460 [TCP segment of a reassembled PDU]","237"
"42","4.735081","192.168.1.122","130.192.1.34","TCP","54","64177  >  443 [ACK] Seq=409 Ack=2921 Win=131328 Len=0","513"
"43","4.735268","130.192.1.34","192.168.1.122","TLSv1.2","568","Certificate, Server Key Exchange, Server Hello Done","237"
"44","4.738162","192.168.1.122","130.192.1.34","TLSv1.2","180","Client Key Exchange, Change Cipher Spec, Encrypted Handshake Message","511"
"45","4.753901","130.192.1.34","192.168.1.122","TLSv1.2","105","Change Cipher Spec, Encrypted Handshake Message","237"
"46","4.754826","192.168.1.122","130.192.1.34","TLSv1.2","253","Application Data","511"
"47","4.772812","130.192.1.34","192.168.1.122","TCP","1514","443  >  64177 [ACK] Seq=3486 Ack=734 Win=31360 Len=1460 [TCP segment of a reassembled PDU]","245"
"48","4.772812","130.192.1.34","192.168.1.122","TCP","1514","443  >  64177 [ACK] Seq=4946 Ack=734 Win=31360 Len=1460 [TCP segment of a reassembled PDU]","245"
"49","4.772812","130.192.1.34","192.168.1.122","TLSv1.2","1370","Application Data","245"
"50","4.773045","192.168.1.122","130.192.1.34","TCP","54","64177  >  443 [ACK] Seq=734 Ack=7722 Win=131328 Len=0","513"
"51","4.773395","130.192.1.34","192.168.1.122","TCP","1514","443  >  64177 [ACK] Seq=7722 Ack=734 Win=31360 Len=1460 [TCP segment of a reassembled PDU]","245"
"52","4.773395","130.192.1.34","192.168.1.122","TCP","1514","443  >  64177 [ACK] Seq=9182 Ack=734 Win=31360 Len=1460 [TCP segment of a reassembled PDU]","245"
"53","4.773395","130.192.1.34","192.168.1.122","TLSv1.2","1259","Application Data","245"
"54","4.773395","130.192.1.34","192.168.1.122","TCP","1514","443  >  64177 [ACK] Seq=11847 Ack=734 Win=31360 Len=1460 [TCP segment of a reassembled PDU]","245"
"55","4.773395","130.192.1.34","192.168.1.122","TCP","1514","443  >  64177 [ACK] Seq=13307 Ack=734 Win=31360 Len=1460 [TCP segment of a reassembled PDU]","245"
"56","4.773395","130.192.1.34","192.168.1.122","TLSv1.2","1259","Application Data","245"
"57","4.773395","130.192.1.34","192.168.1.122","TCP","1514","443  >  64177 [ACK] Seq=15972 Ack=734 Win=31360 Len=1460 [TCP segment of a reassembled PDU]","245"
"58","4.773883","192.168.1.122","130.192.1.34","TCP","54","64177  >  443 [ACK] Seq=734 Ack=17432 Win=131328 Len=0","513"
"59","4.778394","192.168.1.122","130.192.1.34","TCP","54","64176  >  80 [FIN, ACK] Seq=171 Ack=401 Win=130816 Len=0","511"
"60","4.788579","130.192.1.34","192.168.1.122","TCP","1514","443  >  64177 [ACK] Seq=17432 Ack=734 Win=31360 Len=1460 [TCP segment of a reassembled PDU]","245"
"61","4.790046","130.192.1.34","192.168.1.122","TLSv1.2","1514","Application Data [TCP segment of a reassembled PDU]","245"
"62","4.790046","130.192.1.34","192.168.1.122","TCP","1514","443  >  64177 [ACK] Seq=20352 Ack=734 Win=31360 Len=1460 [TCP segment of a reassembled PDU]","245"
"63","4.790046","130.192.1.34","192.168.1.122","TCP","1514","443  >  64177 [ACK] Seq=21812 Ack=734 Win=31360 Len=1460 [TCP segment of a reassembled PDU]","245"
"64","4.790046","130.192.1.34","192.168.1.122","TLSv1.2","1514","Application Data [TCP segment of a reassembled PDU]","245"
"65","4.790046","130.192.1.34","192.168.1.122","TCP","1514","443  >  64177 [ACK] Seq=24732 Ack=734 Win=31360 Len=1460 [TCP segment of a reassembled PDU]","245"
"66","4.790390","192.168.1.122","130.192.1.34","TCP","54","64177  >  443 [ACK] Seq=734 Ack=26192 Win=131328 Len=0","513"
"67","4.791702","130.192.1.34","192.168.1.122","TCP","1514","443  >  64177 [ACK] Seq=26192 Ack=734 Win=31360 Len=1460 [TCP segment of a reassembled PDU]","245"
"68","4.791702","130.192.1.34","192.168.1.122","TLSv1.2","1514","Application Data [TCP segment of a reassembled PDU]","245"
"69","4.791702","130.192.1.34","192.168.1.122","TCP","1514","443  >  64177 [ACK] Seq=29112 Ack=734 Win=31360 Len=1460 [TCP segment of a reassembled PDU]","245"
"70","4.791702","130.192.1.34","192.168.1.122","TCP","1514","443  >  64177 [ACK] Seq=30572 Ack=734 Win=31360 Len=1460 [TCP segment of a reassembled PDU]","245"
"71","4.791702","130.192.1.34","192.168.1.122","TLSv1.2","1514","Application Data [TCP segment of a reassembled PDU]","245"
"72","4.791702","130.192.1.34","192.168.1.122","TCP","1514","443  >  64177 [ACK] Seq=33492 Ack=734 Win=31360 Len=1460 [TCP segment of a reassembled PDU]","245"
"73","4.791702","130.192.1.34","192.168.1.122","TCP","1514","443  >  64177 [ACK] Seq=34952 Ack=734 Win=31360 Len=1460 [TCP segment of a reassembled PDU]","245"
"74","4.791702","130.192.1.34","192.168.1.122","TLSv1.2","1514","Application Data [TCP segment of a reassembled PDU]","245"
"75","4.791702","130.192.1.34","192.168.1.122","TCP","1514","443  >  64177 [ACK] Seq=37872 Ack=734 Win=31360 Len=1460 [TCP segment of a reassembled PDU]","245"
"76","4.791702","130.192.1.34","192.168.1.122","TLSv1.2","1514","Application Data [TCP segment of a reassembled PDU]","245"
"77","4.791702","130.192.1.34","192.168.1.122","TCP","1514","443  >  64177 [ACK] Seq=40792 Ack=734 Win=31360 Len=1460 [TCP segment of a reassembled PDU]","245"
"78","4.791702","130.192.1.34","192.168.1.122","TCP","1514","443  >  64177 [ACK] Seq=42252 Ack=734 Win=31360 Len=1460 [TCP segment of a reassembled PDU]","245"
"79","4.791702","130.192.1.34","192.168.1.122","TLSv1.2","1514","Application Data [TCP segment of a reassembled PDU]","245"
"80","4.791702","130.192.1.34","192.168.1.122","TCP","1514","443  >  64177 [ACK] Seq=45172 Ack=734 Win=31360 Len=1460 [TCP segment of a reassembled PDU]","245"
"81","4.792387","192.168.1.122","130.192.1.34","TCP","54","64177  >  443 [ACK] Seq=734 Ack=46632 Win=131328 Len=0","513"
"82","4.800106","130.192.1.34","192.168.1.122","TCP","60","80  >  64176 [FIN, ACK] Seq=401 Ack=172 Win=30336 Len=0","237"
"83","4.800755","192.168.1.122","130.192.1.34","TCP","54","64176  >  80 [ACK] Seq=172 Ack=402 Win=130816 Len=0","511"
"84","4.806829","130.192.1.34","192.168.1.122","TCP","1514","443  >  64177 [ACK] Seq=46632 Ack=734 Win=31360 Len=1460 [TCP segment of a reassembled PDU]","245"
"85","4.806829","130.192.1.34","192.168.1.122","TLSv1.2","1514","Application Data [TCP segment of a reassembled PDU]","245"
"86","4.806829","130.192.1.34","192.168.1.122","TCP","1514","443  >  64177 [ACK] Seq=49552 Ack=734 Win=31360 Len=1460 [TCP segment of a reassembled PDU]","245"
"87","4.807066","192.168.1.122","130.192.1.34","TCP","54","64177  >  443 [ACK] Seq=734 Ack=51012 Win=131328 Len=0","513"
"88","4.807247","130.192.1.34","192.168.1.122","TCP","1514","443  >  64177 [ACK] Seq=51012 Ack=734 Win=31360 Len=1460 [TCP segment of a reassembled PDU]","245"
"89","4.807247","130.192.1.34","192.168.1.122","TLSv1.2","1514","Application Data [TCP segment of a reassembled PDU]","245"
"90","4.807247","130.192.1.34","192.168.1.122","TCP","1514","443  >  64177 [ACK] Seq=53932 Ack=734 Win=31360 Len=1460 [TCP segment of a reassembled PDU]","245"
"91","4.807414","192.168.1.122","130.192.1.34","TCP","54","64177  >  443 [ACK] Seq=734 Ack=55392 Win=131328 Len=0","513"
"92","4.809313","130.192.1.34","192.168.1.122","TCP","1514","443  >  64177 [ACK] Seq=55392 Ack=734 Win=31360 Len=1460 [TCP segment of a reassembled PDU]","245"
"93","4.809313","130.192.1.34","192.168.1.122","TLSv1.2","1514","Application Data [TCP segment of a reassembled PDU]","245"
"94","4.809313","130.192.1.34","192.168.1.122","TCP","1514","443  >  64177 [ACK] Seq=58312 Ack=734 Win=31360 Len=1460 [TCP segment of a reassembled PDU]","245"
"95","4.809313","130.192.1.34","192.168.1.122","TCP","1514","443  >  64177 [ACK] Seq=59772 Ack=734 Win=31360 Len=1460 [TCP segment of a reassembled PDU]","245"
"96","4.809313","130.192.1.34","192.168.1.122","TLSv1.2","1514","Application Data [TCP segment of a reassembled PDU]","245"
"97","4.809313","130.192.1.34","192.168.1.122","TCP","1514","443  >  64177 [ACK] Seq=62692 Ack=734 Win=31360 Len=1460 [TCP segment of a reassembled PDU]","245"
"98","4.809651","192.168.1.122","130.192.1.34","TCP","54","64177  >  443 [ACK] Seq=734 Ack=64152 Win=131328 Len=0","513"
"99","4.814045","130.192.1.34","192.168.1.122","TLSv1.2","1514","Application Data [TCP segment of a reassembled PDU]","245"
"100","4.814045","130.192.1.34","192.168.1.122","TCP","1514","443  >  64177 [ACK] Seq=65612 Ack=734 Win=31360 Len=1460 [TCP segment of a reassembled PDU]","245"
"101","4.814045","130.192.1.34","192.168.1.122","TCP","1514","443  >  64177 [ACK] Seq=67072 Ack=734 Win=31360 Len=1460 [TCP segment of a reassembled PDU]","245"
"102","4.814045","130.192.1.34","192.168.1.122","TLSv1.2","1514","Application Data [TCP segment of a reassembled PDU]","245"
"103","4.814045","130.192.1.34","192.168.1.122","TCP","1514","443  >  64177 [ACK] Seq=69992 Ack=734 Win=31360 Len=1460 [TCP segment of a reassembled PDU]","245"
"104","4.814045","130.192.1.34","192.168.1.122","TCP","1514","443  >  64177 [ACK] Seq=71452 Ack=734 Win=31360 Len=1460 [TCP segment of a reassembled PDU]","245"
"105","4.814045","130.192.1.34","192.168.1.122","TLSv1.2","1514","Application Data [TCP segment of a reassembled PDU]","245"
"106","4.814045","130.192.1.34","192.168.1.122","TCP","1514","443  >  64177 [ACK] Seq=74372 Ack=734 Win=31360 Len=1460 [TCP segment of a reassembled PDU]","245"
"107","4.814045","130.192.1.34","192.168.1.122","TCP","1514","443  >  64177 [ACK] Seq=75832 Ack=734 Win=31360 Len=1460 [TCP segment of a reassembled PDU]","245"
"108","4.814045","130.192.1.34","192.168.1.122","TLSv1.2","1514","Application Data [TCP segment of a reassembled PDU]","245"
"109","4.814045","130.192.1.34","192.168.1.122","TCP","1514","443  >  64177 [ACK] Seq=78752 Ack=734 Win=31360 Len=1460 [TCP segment of a reassembled PDU]","245"
"110","4.814045","130.192.1.34","192.168.1.122","TCP","1514","443  >  64177 [PSH, ACK] Seq=80212 Ack=734 Win=31360 Len=1460 [TCP segment of a reassembled PDU]","245"
"111","4.814045","130.192.1.34","192.168.1.122","TLSv1.2","354","Application Data","245"
"112","4.814045","130.192.1.34","192.168.1.122","TCP","1514","443  >  64177 [ACK] Seq=81972 Ack=734 Win=31360 Len=1460 [TCP segment of a reassembled PDU]","245"
"113","4.814045","130.192.1.34","192.168.1.122","TCP","1514","443  >  64177 [ACK] Seq=83432 Ack=734 Win=31360 Len=1460 [TCP segment of a reassembled PDU]","245"
"114","4.814045","130.192.1.34","192.168.1.122","TCP","1514","443  >  64177 [ACK] Seq=84892 Ack=734 Win=31360 Len=1460 [TCP segment of a reassembled PDU]","245"
"115","4.814045","130.192.1.34","192.168.1.122","TCP","1514","443  >  64177 [ACK] Seq=86352 Ack=734 Win=31360 Len=1460 [TCP segment of a reassembled PDU]","245"
"116","4.814045","130.192.1.34","192.168.1.122","TCP","1514","443  >  64177 [ACK] Seq=87812 Ack=734 Win=31360 Len=1460 [TCP segment of a reassembled PDU]","245"
"117","4.814045","130.192.1.34","192.168.1.122","TCP","1514","443  >  64177 [ACK] Seq=89272 Ack=734 Win=31360 Len=1460 [TCP segment of a reassembled PDU]","245"
"118","4.814045","130.192.1.34","192.168.1.122","TCP","1514","443  >  64177 [ACK] Seq=90732 Ack=734 Win=31360 Len=1460 [TCP segment of a reassembled PDU]","245"
"119","4.814045","130.192.1.34","192.168.1.122","TCP","1514","443  >  64177 [ACK] Seq=92192 Ack=734 Win=31360 Len=1460 [TCP segment of a reassembled PDU]","245"
"120","4.814045","130.192.1.34","192.168.1.122","TLSv1.2","691","Application Data","245"
"121","4.814045","130.192.1.34","192.168.1.122","TCP","1514","443  >  64177 [ACK] Seq=94289 Ack=734 Win=31360 Len=1460 [TCP segment of a reassembled PDU]","245"
"122","4.814045","130.192.1.34","192.168.1.122","TCP","1514","443  >  64177 [ACK] Seq=95749 Ack=734 Win=31360 Len=1460 [TCP segment of a reassembled PDU]","245"
"123","4.814045","130.192.1.34","192.168.1.122","TLSv1.2","1259","Application Data","245"
"124","4.814045","130.192.1.34","192.168.1.122","TCP","1514","443  >  64177 [ACK] Seq=98414 Ack=734 Win=31360 Len=1460 [TCP segment of a reassembled PDU]","245"
"125","4.814045","130.192.1.34","192.168.1.122","TCP","1514","443  >  64177 [ACK] Seq=99874 Ack=734 Win=31360 Len=1460 [TCP segment of a reassembled PDU]","245"
"126","4.814045","130.192.1.34","192.168.1.122","TLSv1.2","1259","Application Data","245"
"127","4.814754","192.168.1.122","130.192.1.34","TCP","54","64177  >  443 [ACK] Seq=734 Ack=102539 Win=103168 Len=0","403"
"128","4.824394","130.192.1.34","192.168.1.122","TCP","1514","443  >  64177 [ACK] Seq=102539 Ack=734 Win=31360 Len=1460 [TCP segment of a reassembled PDU]","245"
"129","4.824394","130.192.1.34","192.168.1.122","TCP","1514","443  >  64177 [ACK] Seq=103999 Ack=734 Win=31360 Len=1460 [TCP segment of a reassembled PDU]","245"
"130","4.824394","130.192.1.34","192.168.1.122","TLSv1.2","1514","Application Data [TCP segment of a reassembled PDU]","245"
"131","4.824394","130.192.1.34","192.168.1.122","TCP","1514","443  >  64177 [ACK] Seq=106919 Ack=734 Win=31360 Len=1460 [TCP segment of a reassembled PDU]","245"
"132","4.824394","130.192.1.34","192.168.1.122","TCP","1514","443  >  64177 [ACK] Seq=108379 Ack=734 Win=31360 Len=1460 [TCP segment of a reassembled PDU]","245"
"133","4.824394","130.192.1.34","192.168.1.122","TLSv1.2","1514","Application Data [TCP segment of a reassembled PDU]","245"
"134","4.824733","192.168.1.122","130.192.1.34","TCP","54","64177  >  443 [ACK] Seq=734 Ack=111299 Win=94464 Len=0","369"
"135","4.826156","130.192.1.34","192.168.1.122","TCP","1514","443  >  64177 [ACK] Seq=111299 Ack=734 Win=31360 Len=1460 [TCP segment of a reassembled PDU]","245"
"136","4.826156","130.192.1.34","192.168.1.122","TCP","1514","443  >  64177 [ACK] Seq=112759 Ack=734 Win=31360 Len=1460 [TCP segment of a reassembled PDU]","245"
"137","4.826156","130.192.1.34","192.168.1.122","TLSv1.2","1514","Application Data [TCP segment of a reassembled PDU]","245"
"138","4.826289","192.168.1.122","130.192.1.34","TCP","54","64177  >  443 [ACK] Seq=734 Ack=115679 Win=89856 Len=0","351"
"139","4.827358","192.168.1.122","130.192.1.34","TCP","54","[TCP Window Update] 64177  >  443 [ACK] Seq=734 Ack=115679 Win=93440 Len=0","365"
"140","4.828671","192.168.1.122","130.192.1.34","TCP","54","[TCP Window Update] 64177  >  443 [ACK] Seq=734 Ack=115679 Win=131328 Len=0","513"
"141","4.829767","130.192.1.34","192.168.1.122","TCP","1514","443  >  64177 [ACK] Seq=115679 Ack=734 Win=31360 Len=1460 [TCP segment of a reassembled PDU]","245"
"142","4.829767","130.192.1.34","192.168.1.122","TCP","1514","443  >  64177 [ACK] Seq=117139 Ack=734 Win=31360 Len=1460 [TCP segment of a reassembled PDU]","245"
"143","4.829767","130.192.1.34","192.168.1.122","TLSv1.2","1514","Application Data [TCP segment of a reassembled PDU]","245"
"144","4.829767","130.192.1.34","192.168.1.122","TCP","1514","443  >  64177 [ACK] Seq=120059 Ack=734 Win=31360 Len=1460 [TCP segment of a reassembled PDU]","245"
"145","4.829767","130.192.1.34","192.168.1.122","TCP","1514","443  >  64177 [ACK] Seq=121519 Ack=734 Win=31360 Len=1460 [TCP segment of a reassembled PDU]","245"
"146","4.829767","130.192.1.34","192.168.1.122","TLSv1.2","1514","Application Data [TCP segment of a reassembled PDU]","245"
"147","4.829767","130.192.1.34","192.168.1.122","TCP","1514","443  >  64177 [ACK] Seq=124439 Ack=734 Win=31360 Len=1460 [TCP segment of a reassembled PDU]","245"
"148","4.829767","130.192.1.34","192.168.1.122","TLSv1.2","1514","Application Data [TCP segment of a reassembled PDU]","245"
"149","4.829767","130.192.1.34","192.168.1.122","TCP","1514","443  >  64177 [ACK] Seq=127359 Ack=734 Win=31360 Len=1460 [TCP segment of a reassembled PDU]","245"
"150","4.829767","130.192.1.34","192.168.1.122","TCP","1514","443  >  64177 [ACK] Seq=128819 Ack=734 Win=31360 Len=1460 [TCP segment of a reassembled PDU]","245"
"151","4.829767","130.192.1.34","192.168.1.122","TLSv1.2","1514","Application Data [TCP segment of a reassembled PDU]","245"
"152","4.829767","130.192.1.34","192.168.1.122","TCP","1514","443  >  64177 [ACK] Seq=131739 Ack=734 Win=31360 Len=1460 [TCP segment of a reassembled PDU]","245"
"153","4.829767","130.192.1.34","192.168.1.122","TCP","1514","443  >  64177 [ACK] Seq=133199 Ack=734 Win=31360 Len=1460 [TCP segment of a reassembled PDU]","245"
"154","4.829767","130.192.1.34","192.168.1.122","TLSv1.2","1514","Application Data [TCP segment of a reassembled PDU]","245"
"155","4.829767","130.192.1.34","192.168.1.122","TCP","1514","443  >  64177 [ACK] Seq=136119 Ack=734 Win=31360 Len=1460 [TCP segment of a reassembled PDU]","245"
"156","4.830401","192.168.1.122","130.192.1.34","TCP","54","64177  >  443 [ACK] Seq=734 Ack=137579 Win=109312 Len=0","427"
"157","4.831019","130.192.1.34","192.168.1.122","TCP","1514","443  >  64177 [ACK] Seq=137579 Ack=734 Win=31360 Len=1460 [TCP segment of a reassembled PDU]","245"
"158","4.831019","130.192.1.34","192.168.1.122","TLSv1.2","1514","Application Data [TCP segment of a reassembled PDU]","245"
"159","4.831019","130.192.1.34","192.168.1.122","TCP","1514","443  >  64177 [ACK] Seq=140499 Ack=734 Win=31360 Len=1460 [TCP segment of a reassembled PDU]","245"
"160","4.831019","130.192.1.34","192.168.1.122","TCP","1514","443  >  64177 [ACK] Seq=141959 Ack=734 Win=31360 Len=1460 [TCP segment of a reassembled PDU]","245"
"161","4.831019","130.192.1.34","192.168.1.122","TLSv1.2","1514","Application Data [TCP segment of a reassembled PDU]","245"
"162","4.831240","192.168.1.122","130.192.1.34","TCP","54","64177  >  443 [ACK] Seq=734 Ack=144879 Win=102144 Len=0","399"
"163","4.835899","130.192.1.34","192.168.1.122","TCP","1514","443  >  64177 [ACK] Seq=144879 Ack=734 Win=31360 Len=1460 [TCP segment of a reassembled PDU]","245"
"164","4.835899","130.192.1.34","192.168.1.122","TCP","1514","443  >  64177 [ACK] Seq=146339 Ack=734 Win=31360 Len=1460 [TCP segment of a reassembled PDU]","245"
"165","4.835899","130.192.1.34","192.168.1.122","TLSv1.2","1514","Application Data [TCP segment of a reassembled PDU]","245"
"166","4.835899","130.192.1.34","192.168.1.122","TCP","1514","443  >  64177 [ACK] Seq=149259 Ack=734 Win=31360 Len=1460 [TCP segment of a reassembled PDU]","245"
"167","4.835899","130.192.1.34","192.168.1.122","TLSv1.2","1514","Application Data [TCP segment of a reassembled PDU]","245"
"168","4.835899","130.192.1.34","192.168.1.122","TCP","1514","443  >  64177 [ACK] Seq=152179 Ack=734 Win=31360 Len=1460 [TCP segment of a reassembled PDU]","245"
"169","4.835899","130.192.1.34","192.168.1.122","TCP","1514","443  >  64177 [ACK] Seq=153639 Ack=734 Win=31360 Len=1460 [TCP segment of a reassembled PDU]","245"
"170","4.836336","192.168.1.122","130.192.1.34","TCP","54","64177  >  443 [ACK] Seq=734 Ack=155099 Win=91904 Len=0","359"
"171","4.837895","130.192.1.34","192.168.1.122","TLSv1.2","1514","Application Data [TCP segment of a reassembled PDU]","245"
"172","4.837895","130.192.1.34","192.168.1.122","TCP","1514","443  >  64177 [ACK] Seq=156559 Ack=734 Win=31360 Len=1460 [TCP segment of a reassembled PDU]","245"
"173","4.837895","130.192.1.34","192.168.1.122","TCP","1514","443  >  64177 [ACK] Seq=158019 Ack=734 Win=31360 Len=1460 [TCP segment of a reassembled PDU]","245"
"174","4.837895","130.192.1.34","192.168.1.122","TLSv1.2","1514","Application Data [TCP segment of a reassembled PDU]","245"
"175","4.837895","130.192.1.34","192.168.1.122","TCP","1514","443  >  64177 [ACK] Seq=160939 Ack=734 Win=31360 Len=1460 [TCP segment of a reassembled PDU]","245"
"176","4.837895","130.192.1.34","192.168.1.122","TCP","1514","443  >  64177 [ACK] Seq=162399 Ack=734 Win=31360 Len=1460 [TCP segment of a reassembled PDU]","245"
"177","4.837895","130.192.1.34","192.168.1.122","TLSv1.2","1514","Application Data [TCP segment of a reassembled PDU]","245"
"178","4.837895","130.192.1.34","192.168.1.122","TCP","1514","443  >  64177 [ACK] Seq=165319 Ack=734 Win=31360 Len=1460 [TCP segment of a reassembled PDU]","245"
"179","4.837895","130.192.1.34","192.168.1.122","TCP","1514","443  >  64177 [ACK] Seq=166779 Ack=734 Win=31360 Len=1460 [TCP segment of a reassembled PDU]","245"
"180","4.837895","130.192.1.34","192.168.1.122","TLSv1.2","1514","Application Data [TCP segment of a reassembled PDU]","245"
"181","4.837895","130.192.1.34","192.168.1.122","TCP","1514","443  >  64177 [ACK] Seq=169699 Ack=734 Win=31360 Len=1460 [TCP segment of a reassembled PDU]","245"
"182","4.837895","130.192.1.34","192.168.1.122","TCP","1514","443  >  64177 [ACK] Seq=171159 Ack=734 Win=31360 Len=1460 [TCP segment of a reassembled PDU]","245"
"183","4.837895","130.192.1.34","192.168.1.122","TLSv1.2","1514","Application Data [TCP segment of a reassembled PDU]","245"
"184","4.837895","130.192.1.34","192.168.1.122","TCP","1514","443  >  64177 [ACK] Seq=174079 Ack=734 Win=31360 Len=1460 [TCP segment of a reassembled PDU]","245"
"185","4.837895","130.192.1.34","192.168.1.122","TLSv1.2","1514","Application Data [TCP segment of a reassembled PDU]","245"
"186","4.837895","130.192.1.34","192.168.1.122","TCP","1514","443  >  64177 [ACK] Seq=176999 Ack=734 Win=31360 Len=1460 [TCP segment of a reassembled PDU]","245"
"187","4.837895","130.192.1.34","192.168.1.122","TCP","1514","443  >  64177 [ACK] Seq=178459 Ack=734 Win=31360 Len=1460 [TCP segment of a reassembled PDU]","245"
"188","4.837895","130.192.1.34","192.168.1.122","TLSv1.2","1514","Application Data [TCP segment of a reassembled PDU]","245"
"189","4.837895","130.192.1.34","192.168.1.122","TCP","1514","443  >  64177 [ACK] Seq=181379 Ack=734 Win=31360 Len=1460 [TCP segment of a reassembled PDU]","245"
"190","4.837895","130.192.1.34","192.168.1.122","TCP","1514","443  >  64177 [ACK] Seq=182839 Ack=734 Win=31360 Len=1460 [TCP segment of a reassembled PDU]","245"
"191","4.837895","130.192.1.34","192.168.1.122","TLSv1.2","1514","Application Data [TCP segment of a reassembled PDU]","245"
"192","4.837895","130.192.1.34","192.168.1.122","TCP","1514","443  >  64177 [ACK] Seq=185759 Ack=734 Win=31360 Len=1460 [TCP segment of a reassembled PDU]","245"
"193","4.837895","130.192.1.34","192.168.1.122","TCP","1514","443  >  64177 [ACK] Seq=187219 Ack=734 Win=31360 Len=1460 [TCP segment of a reassembled PDU]","245"
"194","4.837895","130.192.1.34","192.168.1.122","TLSv1.2","1514","Application Data [TCP segment of a reassembled PDU]","245"
"195","4.837895","130.192.1.34","192.168.1.122","TCP","1514","443  >  64177 [ACK] Seq=190139 Ack=734 Win=31360 Len=1460 [TCP segment of a reassembled PDU]","245"
"196","4.837895","130.192.1.34","192.168.1.122","TCP","1514","443  >  64177 [ACK] Seq=191599 Ack=734 Win=31360 Len=1460 [TCP segment of a reassembled PDU]","245"
"197","4.837895","130.192.1.34","192.168.1.122","TLSv1.2","1514","Application Data [TCP segment of a reassembled PDU]","245"
"198","4.837895","130.192.1.34","192.168.1.122","TCP","1514","443  >  64177 [ACK] Seq=194519 Ack=734 Win=31360 Len=1460 [TCP segment of a reassembled PDU]","245"
"199","4.837895","130.192.1.34","192.168.1.122","TLSv1.2","1514","Application Data [TCP segment of a reassembled PDU]","245"
"200","4.837895","130.192.1.34","192.168.1.122","TCP","1514","443  >  64177 [ACK] Seq=197439 Ack=734 Win=31360 Len=1460 [TCP segment of a reassembled PDU]","245"
"201","4.837895","130.192.1.34","192.168.1.122","TCP","1514","443  >  64177 [ACK] Seq=198899 Ack=734 Win=31360 Len=1460 [TCP segment of a reassembled PDU]","245"
"202","4.837895","130.192.1.34","192.168.1.122","TLSv1.2","1514","Application Data [TCP segment of a reassembled PDU]","245"
"203","4.839067","192.168.1.122","130.192.1.34","TCP","54","64177  >  443 [ACK] Seq=734 Ack=201819 Win=45056 Len=0","176"
"204","4.839675","130.192.1.34","192.168.1.122","TCP","1514","443  >  64177 [ACK] Seq=201819 Ack=734 Win=31360 Len=1460 [TCP segment of a reassembled PDU]","245"
"205","4.839675","130.192.1.34","192.168.1.122","TCP","1514","443  >  64177 [ACK] Seq=203279 Ack=734 Win=31360 Len=1460 [TCP segment of a reassembled PDU]","245"
"206","4.839675","130.192.1.34","192.168.1.122","TLSv1.2","1022","Application Data [TCP segment of a reassembled PDU]","245"
"207","4.839830","192.168.1.122","130.192.1.34","TCP","54","64177  >  443 [ACK] Seq=734 Ack=205707 Win=41216 Len=0","161"
"208","4.843510","130.192.1.34","192.168.1.122","TCP","1514","443  >  64177 [ACK] Seq=205707 Ack=734 Win=31360 Len=1460 [TCP segment of a reassembled PDU]","245"
"209","4.843510","130.192.1.34","192.168.1.122","TCP","1514","443  >  64177 [ACK] Seq=207167 Ack=734 Win=31360 Len=1460 [TCP segment of a reassembled PDU]","245"
"210","4.843519","192.168.1.122","130.192.1.34","TCP","54","[TCP Window Update] 64177  >  443 [ACK] Seq=734 Ack=205707 Win=44800 Len=0","175"
"211","4.843510","130.192.1.34","192.168.1.122","TCP","546","443  >  64177 [ACK] Seq=208627 Ack=734 Win=31360 Len=492 [TCP segment of a reassembled PDU]","245"
"212","4.843637","192.168.1.122","130.192.1.34","TCP","54","64177  >  443 [ACK] Seq=734 Ack=209119 Win=41216 Len=0","161"
"213","4.843806","130.192.1.34","192.168.1.122","TLSv1.2","1514","Application Data [TCP segment of a reassembled PDU]","245"
"214","4.844841","192.168.1.122","130.192.1.34","TCP","54","64177  >  443 [ACK] Seq=734 Ack=210579 Win=126464 Len=0","494"
"215","4.845214","130.192.1.34","192.168.1.122","TCP","1514","443  >  64177 [ACK] Seq=210579 Ack=734 Win=31360 Len=1460 [TCP segment of a reassembled PDU]","245"
"216","4.845214","130.192.1.34","192.168.1.122","TCP","1514","443  >  64177 [ACK] Seq=212039 Ack=734 Win=31360 Len=1460 [TCP segment of a reassembled PDU]","245"
"217","4.845214","130.192.1.34","192.168.1.122","TLSv1.2","1514","Application Data [TCP segment of a reassembled PDU]","245"
"218","4.845214","130.192.1.34","192.168.1.122","TCP","1514","443  >  64177 [ACK] Seq=214959 Ack=734 Win=31360 Len=1460 [TCP segment of a reassembled PDU]","245"
"219","4.845214","130.192.1.34","192.168.1.122","TCP","1514","443  >  64177 [ACK] Seq=216419 Ack=734 Win=31360 Len=1460 [TCP segment of a reassembled PDU]","245"
"220","4.845214","130.192.1.34","192.168.1.122","TLSv1.2","1514","Application Data [TCP segment of a reassembled PDU]","245"
"221","4.845214","130.192.1.34","192.168.1.122","TCP","1514","443  >  64177 [ACK] Seq=219339 Ack=734 Win=31360 Len=1460 [TCP segment of a reassembled PDU]","245"
"222","4.845214","130.192.1.34","192.168.1.122","TLSv1.2","1514","Application Data [TCP segment of a reassembled PDU]","245"
"223","4.845214","130.192.1.34","192.168.1.122","TCP","1514","443  >  64177 [ACK] Seq=222259 Ack=734 Win=31360 Len=1460 [TCP segment of a reassembled PDU]","245"
"224","4.845214","130.192.1.34","192.168.1.122","TCP","1514","443  >  64177 [ACK] Seq=223719 Ack=734 Win=31360 Len=1460 [TCP segment of a reassembled PDU]","245"
"225","4.845214","130.192.1.34","192.168.1.122","TLSv1.2","1514","Application Data [TCP segment of a reassembled PDU]","245"
"226","4.845214","130.192.1.34","192.168.1.122","TCP","1514","443  >  64177 [ACK] Seq=226639 Ack=734 Win=31360 Len=1460 [TCP segment of a reassembled PDU]","245"
"227","4.845214","130.192.1.34","192.168.1.122","TCP","1514","443  >  64177 [ACK] Seq=228099 Ack=734 Win=31360 Len=1460 [TCP segment of a reassembled PDU]","245"
"228","4.845214","130.192.1.34","192.168.1.122","TLSv1.2","1514","Application Data [TCP segment of a reassembled PDU]","245"
"229","4.845214","130.192.1.34","192.168.1.122","TCP","1514","443  >  64177 [ACK] Seq=231019 Ack=734 Win=31360 Len=1460 [TCP segment of a reassembled PDU]","245"
"230","4.845214","130.192.1.34","192.168.1.122","TCP","1514","443  >  64177 [ACK] Seq=232479 Ack=734 Win=31360 Len=1460 [TCP segment of a reassembled PDU]","245"
"231","4.845214","130.192.1.34","192.168.1.122","TLSv1.2","1514","Application Data [TCP segment of a reassembled PDU]","245"
"232","4.845214","130.192.1.34","192.168.1.122","TCP","1514","443  >  64177 [ACK] Seq=235399 Ack=734 Win=31360 Len=1460 [TCP segment of a reassembled PDU]","245"
"233","4.845736","192.168.1.122","130.192.1.34","TCP","54","64177  >  443 [ACK] Seq=734 Ack=236859 Win=100096 Len=0","391"
"234","4.846284","130.192.1.34","192.168.1.122","TCP","1514","443  >  64177 [ACK] Seq=236859 Ack=734 Win=31360 Len=1460 [TCP segment of a reassembled PDU]","245"
"235","4.846284","130.192.1.34","192.168.1.122","TLSv1.2","1514","Application Data [TCP segment of a reassembled PDU]","245"
"236","4.846284","130.192.1.34","192.168.1.122","TCP","1514","443  >  64177 [ACK] Seq=239779 Ack=734 Win=31360 Len=1460 [TCP segment of a reassembled PDU]","245"
"237","4.846284","130.192.1.34","192.168.1.122","TCP","1514","443  >  64177 [ACK] Seq=241239 Ack=734 Win=31360 Len=1460 [TCP segment of a reassembled PDU]","245"
"238","4.846284","130.192.1.34","192.168.1.122","TLSv1.2","1514","Application Data [TCP segment of a reassembled PDU]","245"
"239","4.846523","192.168.1.122","130.192.1.34","TCP","54","64177  >  443 [ACK] Seq=734 Ack=244159 Win=92928 Len=0","363"
"240","4.848852","130.192.1.34","192.168.1.122","TCP","1514","443  >  64177 [ACK] Seq=244159 Ack=734 Win=31360 Len=1460 [TCP segment of a reassembled PDU]","245"
"241","4.848852","130.192.1.34","192.168.1.122","TLSv1.2","1458","Application Data [TCP segment of a reassembled PDU]","245"
"242","4.849045","192.168.1.122","130.192.1.34","TCP","54","64177  >  443 [ACK] Seq=734 Ack=247023 Win=89856 Len=0","351"
"243","4.860117","130.192.1.34","192.168.1.122","TCP","1514","443  >  64177 [ACK] Seq=247023 Ack=734 Win=31360 Len=1460 [TCP segment of a reassembled PDU]","245"
"244","4.860117","130.192.1.34","192.168.1.122","TCP","1514","443  >  64177 [ACK] Seq=248483 Ack=734 Win=31360 Len=1460 [TCP segment of a reassembled PDU]","245"
"245","4.860117","130.192.1.34","192.168.1.122","TCP","618","443  >  64177 [ACK] Seq=249943 Ack=734 Win=31360 Len=564 [TCP segment of a reassembled PDU]","245"
"246","4.860265","192.168.1.122","130.192.1.34","TCP","54","64177  >  443 [ACK] Seq=734 Ack=250507 Win=86528 Len=0","338"
"247","4.860396","130.192.1.34","192.168.1.122","TLSv1.2","1514","Application Data [TCP segment of a reassembled PDU]","245"
"248","4.860497","192.168.1.122","130.192.1.34","TCP","54","64177  >  443 [ACK] Seq=734 Ack=251967 Win=84992 Len=0","332"
"249","4.860879","130.192.1.34","192.168.1.122","TCP","1514","443  >  64177 [ACK] Seq=251967 Ack=734 Win=31360 Len=1460 [TCP segment of a reassembled PDU]","245"
"250","4.860879","130.192.1.34","192.168.1.122","TCP","1514","443  >  64177 [ACK] Seq=253427 Ack=734 Win=31360 Len=1460 [TCP segment of a reassembled PDU]","245"
"251","4.860879","130.192.1.34","192.168.1.122","TLSv1.2","1514","Application Data [TCP segment of a reassembled PDU]","245"
"252","4.860879","130.192.1.34","192.168.1.122","TCP","1514","443  >  64177 [ACK] Seq=256347 Ack=734 Win=31360 Len=1460 [TCP segment of a reassembled PDU]","245"
"253","4.860879","130.192.1.34","192.168.1.122","TCP","1514","443  >  64177 [ACK] Seq=257807 Ack=734 Win=31360 Len=1460 [TCP segment of a reassembled PDU]","245"
"254","4.860879","130.192.1.34","192.168.1.122","TLSv1.2","1514","Application Data [TCP segment of a reassembled PDU]","245"
"255","4.861149","192.168.1.122","130.192.1.34","TCP","54","64177  >  443 [ACK] Seq=734 Ack=260727 Win=76288 Len=0","298"
"256","4.861409","130.192.1.34","192.168.1.122","TCP","1514","443  >  64177 [ACK] Seq=260727 Ack=734 Win=31360 Len=1460 [TCP segment of a reassembled PDU]","245"
"257","4.861409","130.192.1.34","192.168.1.122","TLSv1.2","1514","Application Data [TCP segment of a reassembled PDU]","245"
"258","4.861540","192.168.1.122","130.192.1.34","TCP","54","64177  >  443 [ACK] Seq=734 Ack=263647 Win=73216 Len=0","286"
"259","4.863555","130.192.1.34","192.168.1.122","TCP","1514","443  >  64177 [ACK] Seq=263647 Ack=734 Win=31360 Len=1460 [TCP segment of a reassembled PDU]","245"
"260","4.863555","130.192.1.34","192.168.1.122","TCP","1514","443  >  64177 [ACK] Seq=265107 Ack=734 Win=31360 Len=1460 [TCP segment of a reassembled PDU]","245"
"261","4.863555","130.192.1.34","192.168.1.122","TLSv1.2","1514","Application Data [TCP segment of a reassembled PDU]","245"
"262","4.863555","130.192.1.34","192.168.1.122","TCP","1514","443  >  64177 [ACK] Seq=268027 Ack=734 Win=31360 Len=1460 [TCP segment of a reassembled PDU]","245"
"263","4.863555","130.192.1.34","192.168.1.122","TCP","1514","443  >  64177 [ACK] Seq=269487 Ack=734 Win=31360 Len=1460 [TCP segment of a reassembled PDU]","245"
"264","4.863555","130.192.1.34","192.168.1.122","TLSv1.2","1514","Application Data [TCP segment of a reassembled PDU]","245"
"265","4.863555","130.192.1.34","192.168.1.122","TCP","1514","443  >  64177 [ACK] Seq=272407 Ack=734 Win=31360 Len=1460 [TCP segment of a reassembled PDU]","245"
"266","4.863555","130.192.1.34","192.168.1.122","TCP","1514","443  >  64177 [ACK] Seq=273867 Ack=734 Win=31360 Len=1460 [TCP segment of a reassembled PDU]","245"
"267","4.863555","130.192.1.34","192.168.1.122","TLSv1.2","1514","Application Data [TCP segment of a reassembled PDU]","245"
"268","4.863555","130.192.1.34","192.168.1.122","TCP","1514","443  >  64177 [ACK] Seq=276787 Ack=734 Win=31360 Len=1460 [TCP segment of a reassembled PDU]","245"
"269","4.863555","130.192.1.34","192.168.1.122","TCP","1514","443  >  64177 [ACK] Seq=278247 Ack=734 Win=31360 Len=1460 [TCP segment of a reassembled PDU]","245"
"270","4.863555","130.192.1.34","192.168.1.122","TLSv1.2","1514","Application Data [TCP segment of a reassembled PDU]","245"
"271","4.863555","130.192.1.34","192.168.1.122","TCP","1514","443  >  64177 [ACK] Seq=281167 Ack=734 Win=31360 Len=1460 [TCP segment of a reassembled PDU]","245"
"272","4.863555","130.192.1.34","192.168.1.122","TLSv1.2","1514","Application Data [TCP segment of a reassembled PDU]","245"
"273","4.863555","130.192.1.34","192.168.1.122","TCP","1514","443  >  64177 [ACK] Seq=284087 Ack=734 Win=31360 Len=1460 [TCP segment of a reassembled PDU]","245"
"274","4.863555","130.192.1.34","192.168.1.122","TCP","1514","443  >  64177 [ACK] Seq=285547 Ack=734 Win=31360 Len=1460 [TCP segment of a reassembled PDU]","245"
"275","4.863555","130.192.1.34","192.168.1.122","TLSv1.2","1514","Application Data [TCP segment of a reassembled PDU]","245"
"276","4.863555","130.192.1.34","192.168.1.122","TCP","1514","443  >  64177 [ACK] Seq=288467 Ack=734 Win=31360 Len=1460 [TCP segment of a reassembled PDU]","245"
"277","4.863555","130.192.1.34","192.168.1.122","TCP","1514","443  >  64177 [ACK] Seq=289927 Ack=734 Win=31360 Len=1460 [TCP segment of a reassembled PDU]","245"
"278","4.863555","130.192.1.34","192.168.1.122","TLSv1.2","1514","Application Data [TCP segment of a reassembled PDU]","245"
"279","4.863555","130.192.1.34","192.168.1.122","TCP","1514","443  >  64177 [ACK] Seq=292847 Ack=734 Win=31360 Len=1460 [TCP segment of a reassembled PDU]","245"
"280","4.863555","130.192.1.34","192.168.1.122","TCP","1006","443  >  64177 [ACK] Seq=294307 Ack=734 Win=31360 Len=952 [TCP segment of a reassembled PDU]","245"
"281","4.863555","130.192.1.34","192.168.1.122","TLSv1.2","1514","Application Data [TCP segment of a reassembled PDU]","245"
"282","4.863555","130.192.1.34","192.168.1.122","TCP","1514","443  >  64177 [ACK] Seq=296719 Ack=734 Win=31360 Len=1460 [TCP segment of a reassembled PDU]","245"
"283","4.863555","130.192.1.34","192.168.1.122","TCP","1514","443  >  64177 [ACK] Seq=298179 Ack=734 Win=31360 Len=1460 [TCP segment of a reassembled PDU]","245"
"284","4.863555","130.192.1.34","192.168.1.122","TLSv1.2","1514","Application Data [TCP segment of a reassembled PDU]","245"
"285","4.863555","130.192.1.34","192.168.1.122","TCP","1514","443  >  64177 [ACK] Seq=301099 Ack=734 Win=31360 Len=1460 [TCP segment of a reassembled PDU]","245"
"286","4.863555","130.192.1.34","192.168.1.122","TCP","1514","443  >  64177 [ACK] Seq=302559 Ack=734 Win=31360 Len=1460 [TCP segment of a reassembled PDU]","245"
"287","4.863555","130.192.1.34","192.168.1.122","TLSv1.2","1514","Application Data [TCP segment of a reassembled PDU]","245"
"288","4.863555","130.192.1.34","192.168.1.122","TCP","1514","443  >  64177 [ACK] Seq=305479 Ack=734 Win=31360 Len=1460 [TCP segment of a reassembled PDU]","245"
"289","4.863555","130.192.1.34","192.168.1.122","TCP","1514","443  >  64177 [ACK] Seq=306939 Ack=734 Win=31360 Len=1460 [TCP segment of a reassembled PDU]","245"
"290","4.863555","130.192.1.34","192.168.1.122","TLSv1.2","1514","Application Data [TCP segment of a reassembled PDU]","245"
"291","4.864829","192.168.1.122","130.192.1.34","TCP","54","64177  >  443 [ACK] Seq=734 Ack=309859 Win=27136 Len=0","106"
"292","4.865444","130.192.1.34","192.168.1.122","TCP","1514","443  >  64177 [ACK] Seq=309859 Ack=734 Win=31360 Len=1460 [TCP segment of a reassembled PDU]","245"
"293","4.865444","130.192.1.34","192.168.1.122","TCP","1514","443  >  64177 [ACK] Seq=311319 Ack=734 Win=31360 Len=1460 [TCP segment of a reassembled PDU]","245"
"294","4.865444","130.192.1.34","192.168.1.122","TLSv1.2","1514","Application Data [TCP segment of a reassembled PDU]","245"
"295","4.865444","130.192.1.34","192.168.1.122","TCP","1514","443  >  64177 [ACK] Seq=314239 Ack=734 Win=31360 Len=1460 [TCP segment of a reassembled PDU]","245"
"296","4.865666","192.168.1.122","130.192.1.34","TCP","54","64177  >  443 [ACK] Seq=734 Ack=315699 Win=21248 Len=0","83"
"297","4.865919","130.192.1.34","192.168.1.122","TLSv1.2","1514","Application Data [TCP segment of a reassembled PDU]","245"
"298","4.866103","130.192.1.34","192.168.1.122","TCP","1514","443  >  64177 [ACK] Seq=317159 Ack=734 Win=31360 Len=1460 [TCP segment of a reassembled PDU]","245"
"299","4.866103","130.192.1.34","192.168.1.122","TCP","1514","443  >  64177 [ACK] Seq=318619 Ack=734 Win=31360 Len=1460 [TCP segment of a reassembled PDU]","245"
"300","4.866103","130.192.1.34","192.168.1.122","TLSv1.2","1514","Application Data [TCP segment of a reassembled PDU]","245"
"301","4.866103","130.192.1.34","192.168.1.122","TCP","1514","443  >  64177 [ACK] Seq=321539 Ack=734 Win=31360 Len=1460 [TCP segment of a reassembled PDU]","245"
"302","4.866289","192.168.1.122","130.192.1.34","TCP","54","64177  >  443 [ACK] Seq=734 Ack=322999 Win=14080 Len=0","55"
"303","4.866758","130.192.1.34","192.168.1.122","TCP","1514","443  >  64177 [ACK] Seq=322999 Ack=734 Win=31360 Len=1460 [TCP segment of a reassembled PDU]","245"
"304","4.866758","130.192.1.34","192.168.1.122","TLSv1.2","1514","Application Data [TCP segment of a reassembled PDU]","245"
"305","4.866758","130.192.1.34","192.168.1.122","TCP","1514","443  >  64177 [ACK] Seq=325919 Ack=734 Win=31360 Len=1460 [TCP segment of a reassembled PDU]","245"
